indexing,file_id,accent,audio_type,duration_seconds,stock_wer,stock_word_accuracy,stock_time_sec,ft_wer,ft_word_accuracy,ft_time_sec,reference,stock_transcript,ft_transcript
542,1042,EN-AU,clean,6.08725,0.578947368,0.421052632,0.523942232,0.368421053,0.631578947,0.576406956,Any more MASTER ALARMs? Schmitt We had one when Ron's - looked like his neck ring hit panel 2., Anymore master alarms. Schmidt we had one when Ronce looked like his neckring hit panel too.," Any more MASTER ALARM S? Schmitt We had one, when Ronce looked like his neckring hit panel 2."
543,1043,EN-AU,clean,2.221125,0.666666667,0.333333333,0.208022118,0,1,0.216743708,Mission Control Okay., Mission control OK., Mission Control Okay.
544,1044,EN-AU,clean,4.6475625,0.333333333,0.666666667,0.320557117,0.083333333,0.916666667,0.324787617,"Sounds like we had something loose in panel 2, huh? Schmitt Yes.", Sounds like we had something loose in panel 2. Ha! Schmidt yes.," Sounds like we had something lose in panel 2, huh? Schmitt Yes."
545,1045,EN-AU,clean,5.1235625,0.111111111,0.888888889,0.38811779,0.111111111,0.888888889,0.392030478,"I don't know - it may be annoying, but so far it doesn't seem to be a problem."," I don't know, it may be annoying, but so far it doesn't seem to be a problem."," I don't know, it may be annoying, but so far it doesn't seem to be a problem."
546,1046,EN-AU,clean,2.1746875,0.333333333,0.666666667,0.177767277,0,1,0.193564892,Mission Control Roger., Mission Control Roger, Mission Control Roger.
547,1047,EN-AU,clean,5.2513125,0,1,0.309268951,0,1,0.294397593,"Just for your information, everything is looking outstanding and no problems."," Just for your information, everything is looking outstanding and no problems."," Just for your information, everything is looking outstanding and no problems."
548,1048,EN-AU,clean,8.5136875,0.12,0.88,0.517772436,0.12,0.88,0.523665667,"We're taking a good look at the data here at Hawaii, and we'll make a GO/NO GO decision about 60 seconds after acquisition at Goldstone."," We're taking a good look at the data here at Hawaii, and we'll make a go-no-go decision about 60 seconds after acquisition at Goldstein."," We're taking a good look at the data here at Hawaii, and we'll make a GO NO-GO decision about 60 seconds after acquisition at Golbstern."
549,1049,EN-AU,clean,5.367375,0.0625,0.9375,0.349096537,0.0625,0.9375,0.360180855,But there's nothing right now to lead us to believe that zero opportunity will be required., But there's nothing right now to let us to believe that zero opportunity will be required., But there's nothing right now to let us to believe that zero opportunity will be required.
550,1050,EN-AU,clean,3.277625,0.8,0.2,0.19597888,0,1,0.255501032,"Cernan Okay, Bob, understand that.", Shannon okay Bob understand that," Cernan Okay, Bob, understand that."
551,1051,EN-AU,clean,2.4533125,0,1,0.255186558,0,1,0.238037586,"We are prepared, however."," We are prepared, however."," We are prepared, however."
552,1052,EN-AU,clean,4.71725,0.3,0.7,0.347688913,0.1,0.9,0.424995184,"Spacecraft, other than those MASTER ALARMs, is looking very good."," spacecraft, other than those master alarms, is looking very good."," Spacecraft, other than those MASTER ALARMS, is looking very good."
553,1053,EN-AU,clean,2.6274375,0,1,0.312655449,0,1,0.236815453,We got the docking probe extended., We got the docking probe extended., We got the docking probe extended.
554,1054,EN-AU,clean,3.533,0.142857143,0.857142857,0.261905432,0.142857143,0.857142857,0.252014637,The SCS reference attitude check is complete., The CCS reference attitude check is complete., The CCS reference attitude check is complete.
555,1055,EN-AU,clean,2.1514375,0.333333333,0.666666667,0.177826166,0,1,0.193976402,Mission Control Roger., Mission Control Roger, Mission Control Roger.
556,1056,EN-AU,clean,7.2714375,0.4,0.6,0.41752696,0.15,0.85,0.475362539,"Schmitt Hey, Bob, I just remembered another switch that I think gave us a MASTER ALARM was H2O QUANTITY INDICATOR."," Schmidt hey Bob, I just remembered another switch that I think gave us a master alarm was two word quantity indicator."," Schmitt Hey, Bob, I just remembered another switch that I think gave us a MASTER ALARM was T-word quantity indicator."
557,1057,EN-AU,clean,2.1398125,0.333333333,0.666666667,0.178518772,0,1,0.191942215,Mission Control Roger., Mission Control Roger, Mission Control Roger.
558,1058,EN-AU,clean,2.02375,0,1,0.203335285,0,1,0.201566458,"Copy that, Jack."," Copy that, Jack."," Copy that, Jack."
559,1059,EN-AU,clean,2.4649375,1,0,0.181538343,1,0,0.225143433,H2O QUANTITY INDICATOR., tumor quantity indicator, T-merc quantity indicator.
560,1060,EN-AU,clean,5.576375,0.066666667,0.933333333,0.35003376,0.133333333,0.866666667,0.369310617,"Mission Control Roger we're - 17, we're going to lose you in about 30 seconds."," Mission Control Roger we're 17, we're going to lose you in about 30 seconds."," Mission Control Roger, we're 17, we're going to lose you in about 30 seconds."
561,1061,EN-AU,clean,11.84575,0.1875,0.8125,0.984271765,0.229166667,0.770833333,1.028000593,"But when you get over the stateside here, we're going to take - take the dump on the data, and we'll read it out real carefully so when you get in TLC we ought to be able to see where that MASTER ALARM glitch is coming in to."," But when you get over the state side here, we're going to take take the dump on the data, and we'll rid it out real carefully so when you get in TLT we ought to be able to see where that muster alarm glitch is coming into."," But, when you get over the state side here, we're going to take-take the dump on the data, and we'll read it out real carefully so when you get in T-L-T we ought to be able to see where that muster alarm glitch is coming into."
562,1062,EN-AU,clean,2.0701875,0.666666667,0.333333333,0.247661591,0,1,0.222113132,"Schmitt Okay, Bob."," Schmidt OK, Bob."," Schmitt Okay, Bob."
563,1063,EN-AU,clean,5.2165,0.2,0.8,0.383598089,0.2,0.8,0.367445707,And - yell at me if you want anything done on the comm with this change in AOS LOS stuff., And yell at me if you want anything done on the con with this change in ASL stuff., And yell at me if you want anything done on the com with this change in ASL stuff.
564,1064,EN-AU,clean,2.964125,0.285714286,0.714285714,0.234400749,0,1,0.251098394,Mission Control Negative on that right now., Mission control negative on that right now., Mission Control Negative on that right now.
565,1065,EN-AU,clean,4.2644375,0.571428571,0.428571429,0.330055475,0.714285714,0.285714286,0.309643745,We'll see you at 01:28:59 through Goldstone., We'll see you at 1.28 and 1.59 for Goldstone., We'll see you at 1 28th and 59th for Goldstone.
566,1066,EN-AU,clean,4.0090625,1.25,0,0.25847578,0.5,0.5,0.303876638,"Cernan Okay, 01:28:59, Bob.", Shurnen OK 128NM 59 Bob," Cernan Okay, 01.28am, 59, Bob."
567,1067,EN-AU,clean,1.5825625,0.333333333,0.666666667,0.190799713,0,1,0.205198765,We'll be there., will be there., We'll be there.
568,1068,EN-AU,clean,2.569375,0.5,0.5,0.190034628,0,1,0.218430042,"Mission Control Roger, Gene.", Mission Control Roger Jean," Mission Control Roger, Gene."
569,1069,EN-AU,clean,4.03225,0.571428571,0.428571429,0.263123751,0.428571429,0.571428571,0.276490688,"GOLDSTONE (REV 2) Mission Control 17, Houston."," Galtston Rift 2 Mission Control 17, Houston"," Galtston REV2 Mission Control 17, Houston."
570,1070,EN-AU,clean,1.8495625,0.5,0.5,0.211429834,0,1,0.247689247,We're back with you., We are back with you., We're back with you.
571,1071,EN-AU,clean,2.221125,0.666666667,0.333333333,0.254085541,0,1,0.255401373,"Cernan Okay, Bob."," Shannon OK, Bob."," Cernan Okay, Bob."
572,1072,EN-AU,clean,3.742,0.083333333,0.916666667,0.367976189,0.083333333,0.916666667,0.492058992,We're still same as before and ready when you are for TLI., We're still same as before and ready when you are for Tly., We're still same as before and ready when you are for T-L-I.
573,1073,EN-AU,clean,2.1630625,0.333333333,0.666666667,0.178253412,0,1,0.192618608,Mission Control Roger., Mission Control Roger, Mission Control Roger.
574,1074,EN-AU,clean,3.939375,0.3,0.7,0.27195859,0,1,0.295606375,"Schmitt I can see the lights of southern California, Bob."," Schmidt I can see the lights of Southern California, Bob"," Schmitt I can see the lights of southern California, Bob."
575,1075,EN-AU,clean,2.6158125,0,1,0.208465338,0,1,0.222450018,"Mission Control Roger, Jack."," Mission Control Roger, Jack."," Mission Control Roger, Jack."
576,1076,EN-AU,clean,3.9974375,0.153846154,0.846153846,0.370194197,0,1,0.328875065,Schmitt We're going to be going a little bit south of that area.," Schmidt, we're going to be going a little bit south of that area.", Schmitt We're going to be going a little bit south of that area.
577,1077,EN-AU,clean,2.116625,0.333333333,0.666666667,0.189896584,0,1,0.193062305,Mission Control Right., Mission Control Right, Mission Control Right.
578,1078,EN-AU,clean,5.56475,0,1,0.369449139,0.176470588,0.823529412,0.433849096,Your ground track looks like it's taking you right up over the mid part of Baja California., Your ground track looks like it's taking you right up over the mid part of Baja California.," Your ground track looks like it's taking you right up over the mid-part of Bah'a, California."
579,1079,EN-AU,clean,2.801625,0.5,0.5,0.263781071,0.166666667,0.833333333,0.270229578,"Schmitt Yes, sir; I'll believe that."," Schmidt yes, sir, I'll believe that."," Schmitt Yes, so, I'll believe that."
580,1080,EN-AU,clean,2.9293125,0.222222222,0.777777778,0.290343523,0.222222222,0.777777778,0.347814083,I'll bet you I can see Ensenada right now., I'll bet you I can see in Santa right now., I'll bet you I can see in center right now.
581,1081,EN-AU,clean,2.1398125,0.333333333,0.666666667,0.203607321,0,1,0.215811014,Mission Control Roger., Mission Control Roger, Mission Control Roger.
582,1082,EN-AU,clean,5.6925,0.0625,0.9375,0.480526447,0,1,0.514743805,"Cernan Bob, I expect he'll probably be able to see the lights of Silver City, too."," Shernan Bob, I expect he'll probably be able to see the lights of Silver City, too."," Cernan Bob, I expect he'll probably be able to see the lights of Silver City, too."
583,1083,EN-AU,clean,4.4501875,0.153846154,0.846153846,0.360432863,0,1,0.351172209,"Schmitt Well, I'm sure going to be looking for them, I'll tell you."," Schmidt, well, I'm sure going to be looking for them, I'll tell you."," Schmitt Well, I'm sure going to be looking for them, I'll tell you."
584,1084,EN-AU,clean,16.7451875,0.1,0.9,0.916096449,0.083333333,0.916666667,0.895442247,"Mission Control Jack, just for your information, you'll probably - when you come up a little farther in this orbit here and get over Mexico, you should be able to see all that bad weather that was giving us so much worry and had Tindall and New Orleans and everything all messed up this morning when I went through there."," Mission Control Jack, just for your information, you'll probably, when you come up a little farther in this orbit here and get over Mexico, you should be able to see all that bad weather that was giving her so much worry and had tindle and new allians and everything all messed up this morning when I went through there."," Mission Control Jack, just for your information, you'll probably, when you come up a little farther in this orbit here and get over Mexico, you should be able to see all that bad weather that was giving us so much worry and had tindle and new audience and everything all messed up this morning when I went through there."
585,1085,EN-AU,clean,3.1034375,0,1,0.267946005,0,1,0.270807981,They had a pretty bad line of weather along there., They had a pretty bad line of weather along there., They had a pretty bad line of weather along there.
586,1086,EN-AU,clean,2.964125,0.125,0.875,0.268191576,0,1,0.272524595,Schmitt I was assuming it wasn't too bad.," Schmidt, I was assuming it wasn't too bad.", Schmitt I was assuming it wasn't too bad.
587,1087,EN-AU,clean,7.213375,0.148148148,0.851851852,0.551670551,0.074074074,0.925925926,0.552940607,"I think you made it, didn't you? Mission Control Oh, yeah, I made it, but I had to - you know, I had to work at it."," I think you made it, didn't you? Mission control, oh yeah, I made it, but I had to, you know, I had to work at it."," I think you made it, didn't you? Mission Control Oh, yeah, I made it, but I had to, you know, I had to work at it."
588,1088,EN-AU,clean,7.8635625,0.258064516,0.741935484,0.505846739,0.193548387,0.806451613,0.66207099,But it's a - we were - I was worried about it getting down as towards MILA there after - you know if we had to scrub and go tomorrow night.," But it's a, we were, I was worried about it getting down as towards Mila thereafter you know if we had to scrub and go tomorrow night."," But it's a, we were, I was worried about it getting down as towards Miller there after you know if we had to scrub and go tomorrow night."
589,1089,EN-AU,clean,3.382125,0,1,0.356234312,0,1,0.31532836,"Boy, I'm sure glad we got you off tonight."," Boy, I'm sure glad we got you off tonight."," Boy, I'm sure glad we got you off tonight."
590,1090,EN-AU,clean,2.116625,0.4,0.6,0.245628834,0.2,0.8,0.284968376,Schmitt Guess who else is., Schmidt gets who else is., Schmitt Guess who else is?
591,1091,EN-AU,clean,4.0090625,0.4,0.6,0.29600358,0.2,0.8,0.30219388,"Mission Control No, I can't - I wouldn't believe that."," Mission control no, I can't, I wouldn't believe that."," Mission Control No, I can't, I wouldn't believe that."
592,1092,EN-AU,clean,2.9176875,0.5,0.5,0.239742041,0,1,0.223571539,Public Affairs This is Apollo Control.," Public affairs, this is Apollo control.", Public Affairs This is Apollo Control.
593,1093,EN-AU,clean,3.440125,0.285714286,0.714285714,0.232697487,0.285714286,0.714285714,0.247621536,1 hour 25 minutes after lift off., one hour 25 minutes after lift off, 1 hour 25 minutes after liftoff.
594,1094,EN-AU,clean,7.6661875,0,1,0.427425861,0.095238095,0.904761905,0.452193975,"During the post-launch press conference at Cape Kennedy, we had a short acquisition with the crew through the Hawaiian tracking station."," During the post-launch press conference at Cape Kennedy, we had a short acquisition with the crew through the Hawaiian tracking station."," During the post-launch press conference at Cape Kennedy, we had a short acquisition with the crew through the Hawaiian Tracking Station."
595,1095,EN-AU,clean,10.115875,0.071428571,0.928571429,0.49504137,0.071428571,0.928571429,0.54213047,"During that period of conversation, and during that period of monitoring the systems on the spacecraft and the launch vehicle, we found that the situation was essentially unchanged."," During that period of conversation and during that period of monitoring the systems in the spacecraft and the launch vehicle, we found that the situation was essentially unchanged."," During that period of conversation and during that period of monitoring the systems and the spacecraft and the launch vehicle, we found that the situation was essentially unchanged."
596,1096,EN-AU,clean,4.98425,0.076923077,0.923076923,0.310858488,0.076923077,0.923076923,0.312051535,"That is, both vehicles now looking good; the spacecraft and the launch vehicle."," That is, both vehicles now looking good the spacecraft and the launch vehicle."," That is, both vehicles now looking good the spacecraft and the launch vehicle."
597,1097,EN-AU,clean,3.8465,0.25,0.75,0.285622358,0,1,0.282138824,And we're progressing toward a normal translunar injection., and we're progressing toward a normal transliner injection., And we're progressing toward a normal translunar injection.
598,1098,EN-AU,clean,3.753625,0.125,0.875,0.261613846,0,1,0.303291321,1 hour 46 minutes 50 seconds from now., 1 hour 46 minutes 50 seconds from now, 1 hour 46 minutes 50 seconds from now.
599,1099,EN-AU,clean,4.0090625,0,1,0.322117567,0,1,0.371072054,The crew has discussed one unexplained series of events., The crew has discussed one unexplained series of events., The crew has discussed one unexplained series of events.
600,1100,EN-AU,clean,10.9518125,0,1,0.613507509,0.083333333,0.916666667,0.614270449,"It appears that when certain switches are cycled or moved on panel 2 which is the main panel in front of them, the center panel of the spacecraft, they're getting a master caution and warning signal."," It appears that when certain switches are cycled or moved on panel 2 which is the main panel in front of them, the center panel of the spacecraft, they're getting a master caution and warning signal."," It appears that when Saturn switches are cycled or moved on panel 2 which is the main panel in front of them, the center panel of the spacecraft, they are getting a master caution and warning signal."
601,1101,EN-AU,noisy,2.97575,0.222222222,0.777777778,0.361111641,0.222222222,0.777777778,0.343158484,A light comes on - a tone comes on.," A light comes on, a tone comes on."," A light comes on, a tone comes on."
602,1102,EN-AU,noisy,9.430875,0.090909091,0.909090909,0.967395067,0.03030303,0.96969697,0.993557692,This is to attract the crews attention that something may be wrong and the normal procedure is then to look at another matrix of lights which would zero them in on the problem.," This is to attract the cruise attention that something may be wrong, and the normal procedure is then to look at another matrix of lights, which would zero them in on the problem.", This is to attract the crew's attention that something may be wrong and the normal procedure is then to look at another matrix of lights which would zero them in on the problem.
603,1103,EN-AU,noisy,7.8055,0.086956522,0.913043478,0.76501441,0.086956522,0.913043478,0.617209435,"The light - the system or the subsystem or particular area being monitored, or which had the problem would light an individual light.", The light the system or the subsystem or particular area being monitored or which had the problem would light an individual light., The light the system or the subsystem or particular area being monitored or which had the problem would light an individual light.
604,1104,EN-AU,noisy,5.855,0,1,0.579537392,0,1,0.579629898,"However, when they go to this other matrix of lights, they find that none of them are lighted."," However, when they go to this other matrix of lights, they find that none of them are lighted."," However, when they go to this other matrix of lights, they find that none of them are lighted."
605,1105,EN-AU,noisy,9.744375,0.147058824,0.852941176,0.864326239,0.088235294,0.911764706,0.877444983,"This is leading the crew and the flight controllers here in mission control to believe that they are getting an spurious signal to the master caution and warning, when in fact nothing is wrong."," This is leading the crew and the flight controllers here in Mission Control to believe that they're getting in spurious signal to the master caution and warning, when in fact nothing is wrong."," This is leading the crew and the flight controllers here in Mission Control to believe that they are getting a spurious signal to the master caution and warning, when in fact nothing is wrong."
606,1106,EN-AU,noisy,4.496625,0,1,0.430679083,0,1,0.431363821,We don't have any further explanation for the problem at this point., We don't have any further explanation for the problem at this point., We don't have any further explanation for the problem at this point.
607,1107,EN-AU,noisy,10.89375,0.081081081,0.918918919,0.99685359,0.027027027,0.972972973,1.000647545,"We will continue to look at the data and particularly during the translunar coast, we think we'll get a good long time to look at things in detail and try to find out precisely what is happening.", We will continue to look at the data and particularly during the Translunar coast. We think we'll get a good long time to look at things in detail and try to find out precisely what is happening.," We will continue to look at the data, and particularly during the translunar coast, we think we'll get a good long time to look at things in detail and try to find out precisely what is happening."
608,1108,EN-AU,noisy,11.66,0.068965517,0.931034483,0.992768764,0.068965517,0.931034483,1.002788782,"At this point however, the problem presents no concern and one of the more likely explanations, or possible explanations that's been advanced is perhaps some contamination in some switches."," At this point, however, the problem presents no concern, and one of the more likely explanations, or possible explanations that's been advanced is perhaps some contamination in some switches."," At this point, however, the problem presents no concern and one of the more likely explanations or possible explanations that's been advanced is perhaps some contamination in some switches."
609,1109,EN-AU,noisy,2.964125,0,1,0.425628901,0,1,0.325396299,Mission Control Parker can't make it back., Mission Control Parker can't make it back., Mission Control Parker can't make it back.
610,1110,EN-AU,noisy,2.801625,0.25,0.75,0.364447594,0.125,0.875,0.368785143,He's got to come back on the golfstream., He's got to come back on the Gulf Stream., He's got to come back on the Gulfstream.
611,1111,EN-AU,noisy,4.2528125,0.25,0.75,0.542963266,0.1875,0.8125,0.580528498,So you might have to have Young on for a while after we do a TLI., so you might have to have Yenlong for a while after we do a Tlai., So you might have to have yon one for a while after we do a T-l-i.
612,1112,EN-AU,noisy,5.599625,0.117647059,0.882352941,0.590991974,0,1,0.615917206,"Schmitt Hey, you just wouldn't believe, Bob, the lights you can see in the west right now."," Schmidt Hay, you just wouldn't believe, Bob, the lights you can see in the west right now."," Schmitt Hey, you just wouldn't believe, Bob, the lights you can see in the west right now."
613,1113,EN-AU,noisy,2.5345625,0,1,0.267352104,0,1,0.267691612,It must be absolutely clear., It must be absolutely clear., It must be absolutely clear.
614,1114,EN-AU,noisy,2.6390625,0,1,0.273614168,0,1,0.266287088,"Mission Control Roger, Jack."," Mission Control Roger, Jack."," Mission Control Roger, Jack."
615,1115,EN-AU,noisy,8.3511875,0.137931034,0.862068966,0.834627628,0,1,1.005470514,"Jack, people in the room here want to know if you've been down your checklist yet? Schmitt Oh, we got that out of the way in about 5 minutes."," Jack, people in the room here want to know if you've been down your checklist yet. Schmidt-O, we got that out of the way in about five minutes."," Jack, people in the room here want to know if you've been down your checklist yet? Schmitt Oh, we got that out of the way in about 5 minutes."
616,1116,EN-AU,noisy,5.2396875,0.142857143,0.857142857,0.653158188,0,1,0.673192501,Have we missed something? Mission Control There's a different checklist here we're talking about., Have we missed something? Mission control there's a different checklist here we're talking about., Have we missed something? Mission Control There's a different checklist here we're talking about.
617,1117,EN-AU,noisy,4.496625,0.545454545,0.454545455,0.522985458,0.363636364,0.636363636,0.55868268,"Schmitt (Laughter) Cernan If you're talking about the Flight Plan, yes."," Schmidt-Lafter-Chernan if you're talking about the flight plan, yes."," Schmitt L'Affetachernan If you're talking about the flight plan, yes."
618,1118,EN-AU,noisy,2.1398125,0.333333333,0.666666667,0.202476501,0,1,0.231693745,Mission Control Roger., Mission Control Roger, Mission Control Roger.
619,1119,EN-AU,noisy,1.9656875,0.25,0.75,0.27667737,0,1,0.250068665,Evans What a waste., Evans What a Waste., Evans What a waste.
620,1120,EN-AU,noisy,4.6475625,0.153846154,0.846153846,0.454915285,0,1,0.478415728,"Schmitt If I'm not mistaken, we must be just south of Arizona now."," Schmidt if I'm not mistaken, we must be just south of Arizona now."," Schmitt If I'm not mistaken, we must be just south of Arizona now."
621,1121,EN-AU,noisy,4.043875,0.3,0.7,0.406402588,0.1,0.9,0.399270773,"is that right, Bob? Mission Control That looks real good."," Is that right, Bob? Mission control that looks real good."," Is that right, Bob? Mission Control That looks real good."
622,1122,EN-AU,noisy,6.528375,0.238095238,0.761904762,0.63834691,0.142857143,0.857142857,0.627109051,"Yes, you're over Mexico there, and looks like you're - oh - maybe a hundred miles south of the border there."," Yes, you're over Mexico there, and looks like you and O may be a hundred miles south of the border there."," Yes, you're over Mexico there, and looks like you're maybe a hundred miles south of the border there."
623,1123,EN-AU,noisy,4.4850625,0.230769231,0.769230769,0.562619448,0.153846154,0.846153846,0.57707572,I was pretty sure I was looking up in the Phoenix-Tucson complex there., I was pretty sure I was looking up in the Phoenix 2 Sun complex there., I was pretty sure I was looking up in the Phoenix 2-sun complex there.
624,1124,EN-AU,noisy,2.1281875,0.333333333,0.666666667,0.257190466,0,1,0.279043436,Mission Control Roger., Mission Control Roger, Mission Control Roger.
625,1125,EN-AU,noisy,3.173125,0.333333333,0.666666667,0.349799395,0.333333333,0.666666667,0.367869377,Schmitt Beautiful - Mission Control Little better than Florida., Schmidt Beautiful Mission Control little better than Florida., Schmitt Beautiful Mission Control A little better than Florida.
626,1126,EN-AU,noisy,1.907625,0.428571429,0.571428571,0.325439215,0.285714286,0.714285714,0.345745564,Schmitt The west is always that way.," Schmidt, the West is always that way."," Schmitt, the west is always that way."
