indexing,file_id,accent,audio_type,duration_seconds,stock_wer,stock_word_accuracy,stock_time_sec,ft_wer,ft_word_accuracy,ft_time_sec,reference,stock_transcript,ft_transcript
1444,1144,EN-Default,noisy,4.9726875,0.333333333,0.666666667,0.57537961,0,1,0.572450876,"Bob, why don't you give us the short count? Mission Control Geno, don't change anything."," Bob, why don't you give us the short count, mission control Gino. Don't change anything."," Bob, why don't you give us the short count? Mission Control Geno, don't change anything."
1445,1145,EN-Default,noisy,3.6839375,0.083333333,0.916666667,0.421547413,0.166666667,0.833333333,0.427980661,"We think it's a ground site situation here, and just stand by.", We think it's a ground site situation here and just stand by.," We think it's a ground site situation here, and just standby."
1446,1146,EN-Default,noisy,2.197875,0.375,0.625,0.412446976,0.125,0.875,0.522200584,"Cernan I believe it's in the VHF, Bob.", Shurn and I believe it's in the Vuff Bob.," Cernan I believe it's in the Vof, Bob."
1447,1147,EN-Default,noisy,1.4664375,1,0,0.333370686,0,1,0.328379631,"Cernan Okay, Bob."," Sure and okay, Bob."," Cernan Okay, Bob."
1448,1148,EN-Default,noisy,9.639875,0.076923077,0.923076923,1.017802477,0.102564103,0.897435897,1.00110817,"I'm not sure exactly where we are, but I'm looking out - to an awful lot of horiz - lights on the horizon out there at 12 o'clock, and an awful lot of lightning in the clouds out there."," I'm not sure exactly where we are, but I'm looking out to an awful lot of Harry's lights on the horizon out there at 12 o'clock, and an awful lot of lightning in the clouds out there."," I'm not sure exactly where we are, but I'm looking out to an awful lot of Harry's lights on the horizon out there at 12 o'clock and an awful lot of lightning in the clouds out there."
1449,1149,EN-Default,noisy,1.60575,0,1,0.224280596,0,1,0.226411343,Mission Control Roger., Mission Control Roger., Mission Control Roger.
1450,1150,EN-Default,noisy,2.801625,0.230769231,0.769230769,0.416690111,0.230769231,0.769230769,0.430909872,I - we show you just about over the middle of the Gulf., I will show you just about over the middle of the gulf., I will show you just about over the middle of the gulf.
1451,1151,EN-Default,noisy,3.9974375,0,1,0.43983674,0,1,0.442219019,"Looking ahead, you're probably seeing the very southern tip of Florida there."," Looking ahead, you're probably seeing the very southern tip of Florida there."," Looking ahead, you're probably seeing the very southern tip of Florida there."
1452,1152,EN-Default,noisy,5.100375,0.222222222,0.777777778,0.650266409,0.111111111,0.888888889,0.707952261,Cernan It looks like almost the entire Florida peninsula has got lights - out by in it somewhere., Churnenit looks like almost the entire Florida Peninsula has got lights out by in it somewhere., Cernan It looks like almost the entire Florida Peninsula has got lights out by in it somewhere.
1453,1153,EN-Default,noisy,1.5593125,0,1,0.228983879,0,1,0.22577095,Mission Control Roger., Mission Control Roger., Mission Control Roger.
1454,1154,EN-Default,noisy,4.5779375,0.235294118,0.764705882,0.618195057,0.058823529,0.941176471,0.597583532,"How does my comm sound to you now, Gene? Cernan Okay, give us a quick short count."," How does my calm sound to you now, Gene? Turnin' okay. Give us a quick short count."," How does my calm sound to you now, Gene? Cernan Okay, give us a quick short count."
1455,1155,EN-Default,noisy,1.617375,0,1,0.233387947,0,1,0.224618435,Mission Control Roger., Mission Control Roger., Mission Control Roger.
1456,1156,EN-Default,noisy,2.8480625,0.125,0.875,0.409697533,0.125,0.875,0.402672052,"Short count follows: 5, 4, 3, 2, 1."," Short count follows 5, 4, 3, 2, 1."," Short count follows 5, 4, 3, 2, 1."
1457,1157,EN-Default,noisy,2.569375,0.125,0.875,0.436988592,0.375,0.625,0.559729815,"1, 2, 3, 4, 5; short count out."," 1, 2, 3, 4, 5, short count out."," 1, 2, 3, 4, 5, short count-out."
1458,1158,EN-Default,noisy,2.08175,0.333333333,0.666666667,0.514190435,0,1,0.466751814,"Cernan Bob, you're all right now."," Shurn and Bob, you're all right now."," Cernan Bob, you're all right now."
1459,1159,EN-Default,noisy,1.44325,0.333333333,0.666666667,0.225883007,0,1,0.228943825,Mission Control Okay., Mission Control OK?, Mission Control Okay.
1460,1160,EN-Default,noisy,5.797,0.130434783,0.869565217,0.687172413,0.043478261,0.956521739,0.658508062,Cernan And can you give us a feel for what the final weather was at the Cape - at launch? Mission Control Yes.," Churnen, and can you give us a feel for what the final weather was at the Cape at launch? Mission Control Yes.", Cernan And can you give us a feel for what the final weather was at the Cape at launch? Mission Control Yes.
1461,1161,EN-Default,noisy,1.4548125,0,1,0.280961037,0,1,0.28104353,Let me get that for you., Let me get that for you., Let me get that for you.
1462,1162,EN-Default,noisy,6.760625,0.142857143,0.857142857,0.89642787,0.178571429,0.821428571,0.841830015,"The reason why we had that problem on the comm is we just handed over from Texas to MILA, and we're - and you're going through MILA now.", The reason why we had that problem on the comm is we just handed over from Texas to Miele and we're in you're going through Miele now.," The reason why we had that problem on the com is we just handed over from Texas to Mila, and we're in, you're going through Mila now."
1463,1163,EN-Default,noisy,1.060125,0.333333333,0.666666667,0.280297756,0.333333333,0.666666667,0.302431345,And it's great., and it's great., and it's great.
1464,1164,EN-Default,noisy,2.60425,0.1,0.9,0.460889101,0,1,0.427740812,So we have a little problem with our Texas site., so we have a little problem with our Texas site., So we have a little problem with our Texas site.
1465,1165,EN-Default,noisy,5.495125,0.25,0.75,0.553433895,0.1,0.9,0.5778687,Mission Control The television coverage had you all the way through staging very well on - and the S-II ignition.," Mission Control, the television coverage had you all the way through staging very well on in the essay ignition.", Mission Control The television coverage had you all the way through staging very well on in the S-II ignition.
1466,1166,EN-Default,noisy,4.2644375,0.058823529,0.941176471,0.51857543,0.058823529,0.941176471,0.520330906,"Then, you went right behind a cloud for a while, but they were tracking you pretty well."," Then you went right behind a cloud for a while, but they were tracking you pretty well."," Then you went right behind a cloud for a while, but they were tracking you pretty well."
1467,1167,EN-Default,noisy,8.20025,0.057142857,0.942857143,0.846330643,0.085714286,0.914285714,0.860004187,"Mission Control They also - cut in for about a half minute or so and showed a view of the crowd in just the available light from the booster, and it stood out pretty well."," Mission Control they also cut in for about a half minute or so and showed a view of the crowd in just the available light from the booster, and it stood out pretty well."," Mission Control They also, cut in for about a half minute or so and showed a view of the crowd and just the available light from the booster, and it stood out pretty well."
1468,1168,EN-Default,noisy,1.327125,0.666666667,0.333333333,0.268364906,0,1,0.303453445,"Schmitt Okay, Bob.", Schmidt okay Bob.," Schmitt Okay, Bob."
1469,1169,EN-Default,noisy,3.2195625,0,1,0.518338203,0,1,0.517725945,"We're going right over Florida now, looking down at Miami."," We're going right over Florida now, looking down at Miami."," We're going right over Florida now, looking down at Miami."
1470,1170,EN-Default,noisy,4.4734375,0.105263158,0.894736842,0.540281296,0.052631579,0.947368421,0.56667161,"A beautiful view of the Keys all lit up, and I just saw a shooting star right over Miami.", A beautiful view of the keys all lit up and I just saw a shooting star right over Miami.," A beautiful view of the keys all lit up, and I just saw a shooting star right over Miami."
1471,1171,EN-Default,noisy,1.60575,0,1,0.230630636,0,1,0.229594707,Mission Control Roger., Mission Control Roger., Mission Control Roger.
1472,1172,EN-Default,noisy,2.8364375,0.222222222,0.777777778,0.415959358,0,1,0.420089245,"Schmitt That's a very, very fine view of Miami."," Schmidt, that's a very, very fine view of Miami."," Schmitt That's a very, very fine view of Miami."
1473,1173,EN-Default,noisy,1.1761875,0,1,0.227578163,0,1,0.226756096,Hard to believe., Hard to believe., Hard to believe.
1474,1174,EN-Default,noisy,2.9525,0.090909091,0.909090909,0.425419569,0,1,0.490709782,Mission Control I'll bet they sat there and watched you go.," Mission Control, I'll bet they sat there and watched you go.", Mission Control I'll bet they sat there and watched you go.
1475,1175,EN-Default,noisy,2.87125,0.2,0.8,0.549829721,0.1,0.9,0.610702276,"Schmitt Looks like we're right over the Bahamas now, Bob."," Schmidt looks like we're right over the Bahamas now, Bob."," Schmitt looks like we're right over the Bahamas now, Bob."
1476,1176,EN-Default,noisy,1.60575,0,1,0.237925529,0,1,0.233892202,Mission Control Roger., Mission Control Roger., Mission Control Roger.
1477,1177,EN-Default,noisy,1.060125,0,1,0.24972868,0,1,0.247513771,I'll buy that., I'll buy that., I'll buy that.
1478,1178,EN-Default,noisy,2.4416875,0.285714286,0.714285714,0.381610394,0,1,0.399907827,"Schmitt Well, I'm not easily impressed, Bob."," Schmidt, well, I'm not easily impressed, Bob."," Schmitt Well, I'm not easily impressed, Bob."
1479,1179,EN-Default,noisy,2.2326875,0.142857143,0.857142857,0.32606101,0.142857143,0.857142857,0.327207565,But I'm certainly impressed by this one., but I'm certainly impressed by this one., but I'm certainly impressed by this one.
1480,1180,EN-Default,noisy,1.5476875,0,1,0.32141614,0,1,0.234120131,Mission Control Roger., Mission Control Roger., Mission Control Roger.
1481,1181,EN-Default,noisy,3.1150625,0.1,0.9,0.568413019,0.1,0.9,0.641225815,What's the CMP doing? We haven't heard much from him., What's the Epsy doing? We haven't heard much from him., What's the EPSI doing? We haven't heard much from him.
1482,1182,EN-Default,noisy,4.7520625,0.315789474,0.684210526,0.540254593,0.210526316,0.789473684,0.5638659,is - is he at the other window? Evans He's crawling around looking for things down in the LEB., Is is yet the other window? Evans he's crawling around looking for things down in the lab., Is is he at the other window? Evans he's crawling around looking for things down in the lab.
1483,1183,EN-Default,noisy,1.8844375,0.75,0.25,0.249917746,0.25,0.75,0.24391675,Mission Control (Laughter) Okay., Mission control after OK., Mission Control After Okay.
1484,1184,EN-Default,noisy,4.9378125,0.166666667,0.833333333,0.655357599,0.111111111,0.888888889,0.62042141,"They won't let you have a window tonight, huh, Ron? Evans No, I'll catch one here pretty quick."," They won't let you have a window tonight, Harun? Evans no, I'll catch one here pretty quick."," They won't let you have a window tonight, Harun? Evans No, I'll catch one here pretty quick."
1485,1185,EN-Default,noisy,3.544625,0.181818182,0.818181818,0.434703827,0,1,0.420996189,"Mission Control Just a reminder, if you haven't already done it."," Mission control just a reminder, if you haven't already done it."," Mission Control Just a reminder, if you haven't already done it."
1486,1186,EN-Default,noisy,5.46025,0.105263158,0.894736842,0.821706533,0.105263158,0.894736842,0.793628454,"There is no need to unstow the TV, because due to this late launch, there's just no site available."," There is no need to un-stow the TV, because due to this late launch, there's just no side available."," There is no need to uninstall the TV, because due to this late launch there's just no site available."
1487,1187,EN-Default,noisy,1.431625,0.666666667,0.333333333,0.340630293,0,1,0.291257381,"Cernan Okay, Bob."," Surenin' okay, Bob."," Cernan Okay, Bob."
1488,1188,EN-Default,noisy,1.7683125,0.166666667,0.833333333,0.365434885,0.166666667,0.833333333,0.34701395,We're not going to unstow it., We're not going to un-stow it., We're not going to unsteal it.
1489,1189,EN-Default,noisy,6.7954375,0.333333333,0.666666667,0.7238307,0.333333333,0.666666667,0.743174791,"Schmitt Bob, I don't - I guess there's no site available for some time, is that correct? Mission Control That's affirmative."," Schmidt Bob, I don't- I guess there's no site available for some time. Is that correct? Mission control, that's affirmative."," Schmitt Bob, I don't-I guess there's no site available for some time. Is that correct? Mission Control, that's affirmative."
1490,1190,EN-Default,noisy,4.61275,0.05,0.95,0.617673874,0.05,0.95,0.617004395,"And if I can pull one of you guys away from a window, I've got a TLI plus 90 pad."," And if I can pull one of you guys away from a window, I've got a PI plus 90 pad."," And if I can pull one of you guys away from a window, I've got a PI plus 90 pad."
1491,1191,EN-Default,noisy,1.8844375,0.285714286,0.714285714,0.451281071,0,1,0.426415443,"Schmitt Oh, I'd love to copy that."," Schmidow, I'd love to copy that."," Schmitt Oh, I'd love to copy that."
1492,1192,EN-Default,noisy,1.0020625,0,1,0.247771263,0,1,0.286177397,Just a minute., Just a minute., Just a minute.
1493,1193,EN-Default,noisy,2.511375,0.6,0.4,0.376713991,0.2,0.8,0.320067644,"Schmitt Hello, Houston; Apollo 17."," Schmidt-Hollow, Houston, Apollo 17."," Schmitt Hello, Houston, Apollo 17."
1494,1194,EN-Default,noisy,2.9989375,0.375,0.625,0.318715096,0.25,0.75,0.357389927,"How do you read? Mission Control 17, Houston.", How do you read Mission Control 17 Houston?," How do you read Mission Control 17, Houston?"
1495,1195,EN-Default,noisy,1.44325,0.166666667,0.833333333,0.289426565,0.166666667,0.833333333,0.306593895,Lost you there for a minute., lost you there for a minute., Lest you there for a minute.
1496,1196,EN-Default,noisy,3.82325,0,1,0.479447603,0.066666667,0.933333333,0.460426331,"We had good signal strength all through that, so I figured it was your problem."," We had good signal strength all through that, so I figured it was your problem.", We had good signal strength all through that so I figured it was your problem.
1497,1197,EN-Default,noisy,1.5709375,0,1,0.253968477,0,1,0.233835459,Mission Control Roger., Mission Control Roger., Mission Control Roger.
1498,1198,EN-Default,noisy,4.3921875,0.263157895,0.736842105,0.765990734,0.210526316,0.789473684,0.702961206,"We're just waiting here - You ready for the pad? Schmitt We were calling you, and you missed us."," We're just waiting here. You ready for the pad? Schmidt, we were calling you and you missed us."," We're just waiting here, you ready for the pad? Schmitt We were calling you and you missed us."
1499,1199,EN-Default,noisy,1.5825625,0,1,0.323211908,0,1,0.294124603,So you might think about that., So you might think about that., So you might think about that.
1500,1200,EN-Default,noisy,1.2806875,0,1,0.253886223,0,1,0.25143528,Ready for the pad., Ready for the pad., Ready for the pad.
1501,1101,EN-Default,noisy,2.0585625,0.222222222,0.777777778,0.34444356,0.333333333,0.666666667,0.342126131,A light comes on - a tone comes on.," A light comes on, a tone comes on."," A light comes on, a tank comes on."
1502,1102,EN-Default,noisy,8.386,0.121212121,0.878787879,0.84387064,0.121212121,0.878787879,0.839087009,This is to attract the crews attention that something may be wrong and the normal procedure is then to look at another matrix of lights which would zero them in on the problem.," This is to attract the crew's attention that something may be wrong, and the normal procedures then to look at another matrix of lights which would zero them in on the problem."," This is to attract the crew's attention that something may be wrong, and the normal procedures then to look at another matrix of lights which would zero them in on the problem."
1503,1103,EN-Default,noisy,6.8070625,0.347826087,0.652173913,0.941771746,0.304347826,0.695652174,0.995372295,"The light - the system or the subsystem or particular area being monitored, or which had the problem would light an individual light."," The light, the system, or the subsystem, a particular area of being monitored, or which had the problem with light and individual light."," The light, the system, or the subsystem, a particular area being monitored, for which had the problem, would light an individual light."
1504,1104,EN-Default,noisy,4.7985,0.333333333,0.666666667,0.651584864,0.277777778,0.722222222,0.555430412,"However, when they go to this other matrix of lights, they find that none of them are lighted."," However, when the dirty the southern rites of lights, they find that none of them are lighted."," However, when they go to the southern exit vents, they find that none of them are lighted."
1505,1105,EN-Default,noisy,9.1058125,0.147058824,0.852941176,0.867928505,0.147058824,0.852941176,0.870945454,"This is leading the crew and the flight controllers here in mission control to believe that they are getting an spurious signal to the master caution and warning, when in fact nothing is wrong.", This is leading the crew and the flight controllers here in Mission Control to believe that they are getting a spurious signal to the master caution in mourning when in fact nothing is wrong.," This is leading the crew and the flight controllers here in Mission Control to believe that they are getting a spurious signal to the master caution in morning, when in fact nothing is wrong."
1506,1106,EN-Default,noisy,3.6839375,0,1,0.416664124,0,1,0.415007353,We don't have any further explanation for the problem at this point., We don't have any further explanation for the problem at this point., We don't have any further explanation for the problem at this point.
1507,1107,EN-Default,noisy,10.1275,0.081081081,0.918918919,1.093570471,0.027027027,0.972972973,1.19535327,"We will continue to look at the data and particularly during the translunar coast, we think we'll get a good long time to look at things in detail and try to find out precisely what is happening."," We will continue to look at the data, and particularly during the Translunar Coast, we think we'll get a good long time to look at things in detail and try to find out precisely what is happening."," We will continue to look at the data, and particularly during the translunar coast, we think we'll get a good long time to look at things in detail and try to find out precisely what is happening."
1508,1108,EN-Default,noisy,10.406125,0.103448276,0.896551724,1.007208586,0.068965517,0.931034483,0.790109396,"At this point however, the problem presents no concern and one of the more likely explanations, or possible explanations that's been advanced is perhaps some contamination in some switches."," At this point, however, the problem presents no concern, and one of the more likely explanations or possible explanations that's been advanced is perhaps some contamination in some switches."," At this point, however, the problem presents no concern and one of the more likely explanations or possible explanations that's been advanced is perhaps some contamination in some switches."
1509,1109,EN-Default,noisy,2.406875,0,1,0.323267937,0,1,0.324135542,Mission Control Parker can't make it back., Mission Control Parker can't make it back., Mission Control Parker can't make it back.
1510,1110,EN-Default,noisy,2.197875,0.375,0.625,0.359959364,0.125,0.875,0.357071161,He's got to come back on the golfstream., he's got to come back on the Gulf Stream., He's got to come back on the Gulfstream.
1511,1111,EN-Default,noisy,3.3008125,0.125,0.875,0.501845121,0.125,0.875,0.506571293,So you might have to have Young on for a while after we do a TLI., So you might have to have Yum on for a while after we do a fly., So you might have to have yam on for a while after we do a try.
1512,1112,EN-Default,noisy,4.3921875,0.235294118,0.764705882,0.609817266,0,1,0.749133348,"Schmitt Hey, you just wouldn't believe, Bob, the lights you can see in the west right now."," Schmid, hey, you just wouldn't believe Bob, the lights you can see in the West right now."," Schmitt Hey, you just wouldn't believe, Bob, the lights you can see in the west right now."
1513,1113,EN-Default,noisy,1.8379375,0,1,0.331371784,0,1,0.316073418,It must be absolutely clear., It must be absolutely clear., It must be absolutely clear.
1514,1114,EN-Default,noisy,1.8611875,0.25,0.75,0.242132187,0,1,0.266043901,"Mission Control Roger, Jack.", Mission Control Roger Jack.," Mission Control Roger, Jack."
1515,1115,EN-Default,noisy,7.3875625,0.137931034,0.862068966,0.835785389,0.034482759,0.965517241,0.85102129,"Jack, people in the room here want to know if you've been down your checklist yet? Schmitt Oh, we got that out of the way in about 5 minutes."," Jack, people in the room here want to know if you've been down your checklist yet. Schmidt, oh, we got that out of the way in about five minutes."," Jack, people in the room here want to know if you've been down your checklist yet, Schmitt Oh, we got that out of the way in about 5 minutes."
1516,1116,EN-Default,noisy,4.7985,0.142857143,0.857142857,0.528084755,0.142857143,0.857142857,0.476211548,Have we missed something? Mission Control There's a different checklist here we're talking about.," Have we missed something? Mission Control, there's a different checklist here we're talking about.", Having missed something? Mission Control There's a different checklist here we're talking about.
1517,1117,EN-Default,noisy,3.4981875,0.545454545,0.454545455,0.488333464,0.454545455,0.545454545,0.523618698,"Schmitt (Laughter) Cernan If you're talking about the Flight Plan, yes."," Schmidt, Laughterchern and if you're talking about the flight plan, yes."," Schmitt Laptrachernan if you're talking about the flight plan, yes."
1518,1118,EN-Default,noisy,1.5476875,0,1,0.2511518,0,1,0.267238617,Mission Control Roger., Mission Control Roger., Mission Control Roger.
1519,1119,EN-Default,noisy,1.408375,0.25,0.75,0.308131695,0,1,0.316771746,Evans What a waste., Evans What a Waste., Evans What a waste.
1520,1120,EN-Default,noisy,3.7188125,0.230769231,0.769230769,0.483283997,0.076923077,0.923076923,0.505254745,"Schmitt If I'm not mistaken, we must be just south of Arizona now."," which meant if I'm not mistaken, we must be just south of Arizona now."," Schmitt if I'm not mistaken, we must be just south of Arizona now."
1521,1121,EN-Default,noisy,3.1963125,0.5,0.5,0.3968575,0.1,0.9,0.403945446,"is that right, Bob? Mission Control That looks real good."," is that rate bar, mission control that looks real good."," Is that right, Bob? Mission Control That looks real good."
1522,1122,EN-Default,noisy,5.390625,0.238095238,0.761904762,0.603302956,0.238095238,0.761904762,0.602142811,"Yes, you're over Mexico there, and looks like you're - oh - maybe a hundred miles south of the border there."," Yes, you're over Mexico there, and looks like you're over maybe 100 miles south of the border there."," Yes, you're over Mexico there, and looks like you're over maybe 100 miles south of the border there."
1523,1123,EN-Default,noisy,3.7188125,0.153846154,0.846153846,0.443402052,0.153846154,0.846153846,0.55896163,I was pretty sure I was looking up in the Phoenix-Tucson complex there., I was pretty sure I was looking up in the Phoenix Tucson complex there., I was pretty sure I was looking up in the Phoenix Tucson complex there.
1524,1124,EN-Default,noisy,1.640625,0.333333333,0.666666667,0.283018112,0,1,0.294537783,Mission Control Roger.," Mission Control, Roger.", Mission Control Roger.
1525,1125,EN-Default,noisy,3.1615,0.666666667,0.333333333,0.339661598,0.333333333,0.666666667,0.36089325,Schmitt Beautiful - Mission Control Little better than Florida., Schmidt beautiful mission control a little better than Florida., Schmitt Beautiful Mission Control A little better than Florida.
1526,1126,EN-Default,noisy,1.9773125,0.428571429,0.571428571,0.309608936,0.142857143,0.857142857,0.292687416,Schmitt The west is always that way., Smith the West is always that way., The west is always that way.
1527,1127,EN-Default,noisy,3.24275,0.076923077,0.923076923,0.446240187,0.076923077,0.923076923,0.440104008,I wish it was daylight so we could see Sonora and that country., I wish it was daylight so we could see Sonora in that country., I wish it was daylight so we could see Sonora in that country.
1528,1128,EN-Default,noisy,2.1281875,0.2,0.8,0.331691027,0,1,0.322220564,"That's spectacular, I'll bet you.", That's spectacular. I'll bet you.," That's spectacular, I'll bet you."
1529,1129,EN-Default,noisy,1.5825625,0,1,0.22513175,0,1,0.234878063,Mission Control Roger., Mission Control Roger., Mission Control Roger.
1530,1130,EN-Default,noisy,4.0786875,0.357142857,0.642857143,0.522546053,0.142857143,0.857142857,0.54599905,"Schmitt Man's field of stars on the Earth is competing with the heavens, Bob.", Schmidtman's field of stars on the earth is competing with the heavens ball., Schmitt Man's field of stars on the Earth is competing with the Heaven spot.
1531,1131,EN-Default,noisy,4.310875,0.214285714,0.785714286,0.607410431,0.071428571,0.928571429,0.531122923,"Cernan Bob, you're coming through with a large squeal right now in the background."," Turn and bob, you're coming through with a large squeal right now in the background."," Cernan Bob, you're coming through with a large wheel right now in the background."
