indexing,file_id,accent,audio_type,duration_seconds,stock_wer,stock_word_accuracy,stock_time_sec,ft_wer,ft_word_accuracy,ft_time_sec,reference,stock_transcript,ft_transcript
1000,1100,EN-BR,clean,10.499,0.138888889,0.861111111,0.655146599,0.083333333,0.916666667,0.621422768,"It appears that when certain switches are cycled or moved on panel 2 which is the main panel in front of them, the center panel of the spacecraft, they're getting a master caution and warning signal."," It appears that when sudden switches are cycled or moved on panel 2, which is the main panel in front of them, the centre panel of the spacecraft, they are getting a master caution and warning signal."," It appears that when Saturn switches are cycled or moved on panel 2 which is the main panel in front of them, the center panel of the spacecraft, they are getting a master caution and warning signal."
1001,1101,EN-BR,noisy,2.2559375,0.222222222,0.777777778,0.35307765,0.222222222,0.777777778,0.351594925,A light comes on - a tone comes on.," A light comes on, a tone comes on."," A light comes on, a tone comes on."
1002,1102,EN-BR,noisy,8.850375,0.03030303,0.96969697,0.826965094,0.03030303,0.96969697,0.837566137,This is to attract the crews attention that something may be wrong and the normal procedure is then to look at another matrix of lights which would zero them in on the problem., This is to attract the crew's attention that something may be wrong and the normal procedure is then to look at another matrix of lights which would zero them in on the problem., This is to attract the crew's attention that something may be wrong and the normal procedure is then to look at another matrix of lights which would zero them in on the problem.
1003,1103,EN-BR,noisy,7.2714375,0.086956522,0.913043478,0.621171713,0.086956522,0.913043478,0.629925251,"The light - the system or the subsystem or particular area being monitored, or which had the problem would light an individual light.", The light the system or the subsystem or particular area being monitored or which had the problem would light an individual light., The light the system or the subsystem or particular area being monitored or which had the problem would light an individual light.
1004,1104,EN-BR,noisy,5.29775,0,1,0.593964577,0,1,0.582392931,"However, when they go to this other matrix of lights, they find that none of them are lighted."," However, when they go to this other matrix of lights, they find that none of them are lighted."," However, when they go to this other matrix of lights, they find that none of them are lighted."
1005,1105,EN-BR,noisy,9.3844375,0.088235294,0.911764706,0.881134748,0.088235294,0.911764706,1.026936531,"This is leading the crew and the flight controllers here in mission control to believe that they are getting an spurious signal to the master caution and warning, when in fact nothing is wrong."," This is leading the crew and the flight controllers here in Mission Control to believe that they are getting an superior signal to the master caution and warning, when in fact nothing is wrong."," This is leading the crew and the flight controllers here in Mission Control to believe that they are getting a spurious signal to the master caution and warning, when in fact nothing is wrong."
1006,1106,EN-BR,noisy,3.834875,0,1,0.489715338,0,1,0.534939528,We don't have any further explanation for the problem at this point., We don't have any further explanation for the problem at this point., We don't have any further explanation for the problem at this point.
1007,1107,EN-BR,noisy,10.591875,0.081081081,0.918918919,1.17688036,0.027027027,0.972972973,0.993477345,"We will continue to look at the data and particularly during the translunar coast, we think we'll get a good long time to look at things in detail and try to find out precisely what is happening."," We will continue to look at the data, and particularly during the Translunar Coast, we think we'll get a good long time to look at things in detail and try to find out precisely what is happening."," We will continue to look at the data, and particularly during the translunar coast, we think we'll get a good long time to look at things in detail and try to find out precisely what is happening."
1008,1108,EN-BR,noisy,10.5454375,0.068965517,0.931034483,0.782768965,0.103448276,0.896551724,0.817103624,"At this point however, the problem presents no concern and one of the more likely explanations, or possible explanations that's been advanced is perhaps some contamination in some switches."," At this point, however, the problem presents no concern and one of the more likely explanations or possible explanations that's been advanced is perhaps some contamination in some switches."," At this point, however, the problem presents no concern, and one of the more likely explanations or possible explanations that's been advanced is perhaps some contamination in some switches."
1009,1109,EN-BR,noisy,2.7319375,0,1,0.324367762,0,1,0.329870224,Mission Control Parker can't make it back., Mission Control Parker can't make it back., Mission Control Parker can't make it back.
1010,1110,EN-BR,noisy,2.4300625,0.25,0.75,0.36778307,0.25,0.75,0.382385015,He's got to come back on the golfstream., He's got to come back on the Gulf Stream., He's got to come back on the GOAL stream.
1011,1111,EN-BR,noisy,3.4865625,0.25,0.75,0.48131299,0.1875,0.8125,0.569985151,So you might have to have Young on for a while after we do a TLI., Say you might have to have young one for a while after we do a tie., So you might have to have young one for a while after we do a T-L-I.
1012,1112,EN-BR,noisy,4.786875,0.176470588,0.823529412,0.599340677,0,1,0.700092554,"Schmitt Hey, you just wouldn't believe, Bob, the lights you can see in the west right now."," Schmidt, hey, you just wouldn't believe, Bob, the lights you can see in the West right now."," Schmitt Hey, you just wouldn't believe, Bob, the lights you can see in the west right now."
1013,1113,EN-BR,noisy,1.896,0,1,0.30306673,0,1,0.306670904,It must be absolutely clear., It must be absolutely clear., It must be absolutely clear.
1014,1114,EN-BR,noisy,2.0469375,0.5,0.5,0.286159754,0,1,0.270872831,"Mission Control Roger, Jack.", Mission Control Roger Jack," Mission Control Roger, Jack."
1015,1115,EN-BR,noisy,7.8635625,0.172413793,0.827586207,0.871888638,0.103448276,0.896551724,0.853672981,"Jack, people in the room here want to know if you've been down your checklist yet? Schmitt Oh, we got that out of the way in about 5 minutes."," Shaq, people in the room here want to know if you've been down your checklist yet. Schmidt, oh, we got that out of the way in about five minutes."," Jack, people in the room here want to know if you've been down your checklist yet? Schmitt, oh, we got that out of the way in about five minutes."
1016,1116,EN-BR,noisy,4.903,0.142857143,0.857142857,0.51906538,0,1,0.501101732,Have we missed something? Mission Control There's a different checklist here we're talking about.," Have we missed something? Mission control, there's a different checklist here we're talking about.", Have we missed something? Mission Control There's a different checklist here we're talking about.
1017,1117,EN-BR,noisy,3.76525,0.636363636,0.363636364,0.475393772,0.363636364,0.636363636,0.586444855,"Schmitt (Laughter) Cernan If you're talking about the Flight Plan, yes.", Schmidt Laugh to Churnen if you're talking about the flight plan yes.," Schmitt L'Affetor Cernan if you're talking about the flight plan, yes."
1018,1118,EN-BR,noisy,1.7683125,0.333333333,0.666666667,0.208744049,0,1,0.234277964,Mission Control Roger., Mission Control Roger, Mission Control Roger.
1019,1119,EN-BR,noisy,1.50125,0.5,0.5,0.274306297,0.5,0.5,0.269922733,Evans What a waste.," Evans, what a waste."," Evans, what a waste."
1020,1120,EN-BR,noisy,4.2876875,0.153846154,0.846153846,0.505865574,0,1,0.587414742,"Schmitt If I'm not mistaken, we must be just south of Arizona now."," Schmitt, if I'm not mistaken, we must be just south of Arizona now."," Schmitt If I'm not mistaken, we must be just south of Arizona now."
1021,1121,EN-BR,noisy,3.2311875,0.3,0.7,0.45796895,0.1,0.9,0.487220764,"is that right, Bob? Mission Control That looks real good."," Is that right, Bob? Mission control that looks real good."," Is that right, Bob? Mission Control That looks real good."
1022,1122,EN-BR,noisy,5.5531875,0.285714286,0.714285714,0.67437005,0.19047619,0.80952381,0.653967857,"Yes, you're over Mexico there, and looks like you're - oh - maybe a hundred miles south of the border there."," Yes, you're over Mexico there and looks like your row may be a hundred miles south of the border there."," Yes, you're over Mexico there, and looks like you're oh, maybe, a hundred miles south of the border there."
1023,1123,EN-BR,noisy,3.7188125,0.153846154,0.846153846,0.441095352,0.153846154,0.846153846,0.448220968,I was pretty sure I was looking up in the Phoenix-Tucson complex there., I was pretty sure I was looking up in the Phoenix Tucson complex there., I was pretty sure I was looking up in the Phoenix Tucson complex there.
1024,1124,EN-BR,noisy,1.6754375,0.333333333,0.666666667,0.21512866,0,1,0.233844995,Mission Control Roger., Mission Control Roger, Mission Control Roger.
1025,1125,EN-BR,noisy,3.4053125,0.333333333,0.666666667,0.325951338,0.222222222,0.777777778,0.346084833,Schmitt Beautiful - Mission Control Little better than Florida., Schmidt Beautiful Mission Control little better than Florida., Schmitt Beautiful Mission Control little better than Florida.
1026,1126,EN-BR,noisy,2.2095,0.428571429,0.571428571,0.333797932,0,1,0.353929996,Schmitt The west is always that way.," Schmidt, the West is always that way.", Schmitt The west is always that way.
1027,1127,EN-BR,noisy,3.3008125,0.076923077,0.923076923,0.439364195,0.076923077,0.923076923,0.449154854,I wish it was daylight so we could see Sonora and that country., I wish it was daylight so we could see Sonora in that country., I wish it was daylight so we could see Sonora in that country.
1028,1128,EN-BR,noisy,2.3604375,0,1,0.326981783,0,1,0.358662128,"That's spectacular, I'll bet you."," That's spectacular, I'll bet you."," That's spectacular, I'll bet you."
1029,1129,EN-BR,noisy,1.7335,0.333333333,0.666666667,0.241861343,0,1,0.260635376,Mission Control Roger., Mission Control Roger, Mission Control Roger.
1030,1130,EN-BR,noisy,4.1715625,0.214285714,0.785714286,0.6269238,0.214285714,0.785714286,0.664743662,"Schmitt Man's field of stars on the Earth is competing with the heavens, Bob."," Schmidt Man's Field of Stars on the Earth is competing with the heavens, Bob."," Schmitt Manned Field of Stars on the Earth is competing with the heavens, Bob."
1031,1131,EN-BR,noisy,4.334125,0.142857143,0.857142857,0.569893837,0,1,0.549654961,"Cernan Bob, you're coming through with a large squeal right now in the background."," Churn and Bob, you're coming through with a large squeal right now in the background."," Cernan Bob, you're coming through with a large squeal right now in the background."
1032,1132,EN-BR,noisy,6.0291875,0.285714286,0.714285714,0.641670942,0,1,0.664830923,"Mission Control Understand Schmitt Okay, I think we got the Gulf Coast showing up now by the band of lights, Bob.", Mission control under Stanch Mitt okay. I think we got the Gulf Coast showing up now by the band of lights Bob.," Mission Control Understand Schmitt Okay, I think we got the Gulf Coast showing up now by the band of lights, Bob."
1033,1133,EN-BR,noisy,1.7915,0.333333333,0.666666667,0.214496613,0,1,0.230965853,Mission Control Roger., Mission Control Roger, Mission Control Roger.
1034,1134,EN-BR,noisy,1.4548125,1,0,0.277575731,0,1,0.289518118,"Cernan Okay, Bob."," Sure and okay, Bob."," Cernan Okay, Bob."
1035,1135,EN-BR,noisy,4.334125,0.266666667,0.733333333,0.482247114,0.133333333,0.866666667,0.59467864,"Assume the booster is still looking good, and we'll be GO for a nominal TLI.", Assume the booster is still looking good and will be go for a nominal try., Assume the booster is still looking good and we'll be GO for a nominal T-L-I.
1036,1136,EN-BR,noisy,2.2559375,0.5,0.5,0.29973793,0,1,0.274549484,Mission Control That's affirmative.," Mission control, that's affirmative.", Mission Control That's affirmative.
1037,1137,EN-BR,noisy,2.97575,0.4,0.6,0.489473104,0,1,0.516705513,Cernan And you're still coming up with a loud squeal., Shannon and you are still coming up with a loud squeal., Cernan And you're still coming up with a loud squeal.
1038,1138,EN-BR,noisy,1.7335,0.333333333,0.666666667,0.267149925,0,1,0.264204979,Mission Control Roger., Mission Control Roger, Mission Control Roger.
1039,1139,EN-BR,noisy,10.2784375,0.166666667,0.833333333,1.040967464,0.133333333,0.866666667,0.994018316,"Mission Control 17, how do you read? Schmitt Would you believe we're just south of Houston now, Bob? Mission Control 17, are you receiving Houston now? Cernan All right, Bob."," Mission Control 17, how do you read? Schmidt, would you believe we're just south of Houston now, Bob? Mission Control 17, are you receiving Houston now? Turn in alright, Bob."," Mission Control 17, how do you read? Schmitt, would you believe we're just south of Houston now, Bob? Mission Control 17, are you receiving Houston now? Cernan Alright, Bob."
1040,1140,EN-BR,noisy,2.9409375,0,1,0.412685156,0,1,0.409769058,You came up unreadable with the squeal that time., You came up unreadable with the squeal that time., You came up unreadable with the squeal that time.
1041,1141,EN-BR,noisy,3.34725,0.555555556,0.444444444,0.350314856,0,1,0.383781195,Mission Control Am I still squealing? This is Houston., Mission controller my still squealing. This is Houston, Mission Control Am I still squealing? This is Houston.
1042,1142,EN-BR,noisy,1.629,1.333333333,0,0.316759586,0,1,0.305273771,Cernan That's affirm.," Shonen, that's a phone.", Cernan That's affirm.
1043,1143,EN-BR,noisy,3.1266875,0,1,0.422701359,0,1,0.423289299,"You're very loud, almost unreadable with the squeal."," You're very loud, almost unreadable with the squeal."," You're very loud, almost unreadable with the squeal."
1044,1144,EN-BR,noisy,5.0306875,0,1,0.577337742,0,1,0.58138442,"Bob, why don't you give us the short count? Mission Control Geno, don't change anything."," Bob, why don't you give us the short count? Mission Control Geno, don't change anything."," Bob, why don't you give us the short count? Mission Control Geno, don't change anything."
1045,1145,EN-BR,noisy,3.916125,0.083333333,0.916666667,0.492865801,0.166666667,0.833333333,0.506362677,"We think it's a ground site situation here, and just stand by.", We think it's a ground site situation here and just stand by.," We think it's a ground site situation here, and just standby."
1046,1146,EN-BR,noisy,2.302375,0.25,0.75,0.453807592,0.125,0.875,0.52216959,"Cernan I believe it's in the VHF, Bob."," Shannon, I believe it's in the bath, Bob."," Cernan I believe it's in the VAT, Bob."
1047,1147,EN-BR,noisy,1.5593125,0.666666667,0.333333333,0.269532204,0,1,0.292285681,"Cernan Okay, Bob."," Shining okay, Bob."," Cernan Okay, Bob."
1048,1148,EN-BR,noisy,9.814,0.102564103,0.897435897,1.038837671,0.102564103,0.897435897,1.024813652,"I'm not sure exactly where we are, but I'm looking out - to an awful lot of horiz - lights on the horizon out there at 12 o'clock, and an awful lot of lightning in the clouds out there."," I'm not sure exactly where we are, but I'm looking out to an awful lot of Haris lights on the horizon out there at 12 o'clock and an awful lot of lightning in the clouds out there."," I'm not sure exactly where we are, but I'm looking out to an awful lot of Harry's lights on the horizon out there at 12 o'clock and an awful lot of lightning in the clouds out there."
1049,1149,EN-BR,noisy,1.6870625,0.333333333,0.666666667,0.211597681,0,1,0.233947515,Mission Control Roger., Mission Control Roger, Mission Control Roger.
1050,1150,EN-BR,noisy,2.987375,0.230769231,0.769230769,0.411328554,0.230769231,0.769230769,0.421653748,I - we show you just about over the middle of the Gulf., I will show you just about over the middle of the golf., I will show you just about over the middle of the gulf.
1051,1151,EN-BR,noisy,4.1948125,0,1,0.447408199,0,1,0.444561243,"Looking ahead, you're probably seeing the very southern tip of Florida there."," Looking ahead, you're probably seeing the very southern tip of Florida there."," Looking ahead, you're probably seeing the very southern tip of Florida there."
1052,1152,EN-BR,noisy,5.4138125,0.222222222,0.777777778,0.538352251,0.111111111,0.888888889,0.658019543,Cernan It looks like almost the entire Florida peninsula has got lights - out by in it somewhere., Shennan it looks like almost the entire Florida Peninsula has got lights out by in it somewhere., Cernan It looks like almost the entire Florida Peninsula has got lights out by in it somewhere.
1053,1153,EN-BR,noisy,1.7335,0.333333333,0.666666667,0.24468708,0,1,0.284584045,Mission Control Roger., Mission Control Roger, Mission Control Roger.
1054,1154,EN-BR,noisy,4.9494375,0.294117647,0.705882353,0.746183157,0.058823529,0.941176471,0.605423689,"How does my comm sound to you now, Gene? Cernan Okay, give us a quick short count."," How does my comm sound to you now, Jean? Turn an okay. Give us a quick short count."," How does my COMM sound to you now, Gene? Cernan Okay, give us a quick short count."
1055,1155,EN-BR,noisy,1.7450625,0.333333333,0.666666667,0.21372366,0,1,0.238047838,Mission Control Roger., Mission Control Roger, Mission Control Roger.
1056,1156,EN-BR,noisy,2.987375,0.125,0.875,0.436763525,0.125,0.875,0.400377512,"Short count follows: 5, 4, 3, 2, 1."," Short count follows 5, 4, 3, 2, 1."," Short count follows 5, 4, 3, 2, 1."
1057,1157,EN-BR,noisy,2.8945,0.125,0.875,0.445054054,0.375,0.625,0.405367374,"1, 2, 3, 4, 5; short count out."," 1, 2, 3, 4, 5, short count out."," 1, 2, 3, 4, 5, short countdown."
1058,1158,EN-BR,noisy,2.0469375,0.166666667,0.833333333,0.377880096,0,1,0.374446869,"Cernan Bob, you're all right now."," Shurnen Bob, you're all right now."," Cernan Bob, you're all right now."
1059,1159,EN-BR,noisy,1.698625,0.666666667,0.333333333,0.229205847,0,1,0.234477043,Mission Control Okay., Mission control okay?, Mission Control Okay.
1060,1160,EN-BR,noisy,5.87825,0.130434783,0.869565217,0.652329922,0.043478261,0.956521739,0.64898181,Cernan And can you give us a feel for what the final weather was at the Cape - at launch? Mission Control Yes.," Shunnan, can you give us a feel for what the final weather was at the Cape at launch? Mission Control Yes.", Cernan And can you give us a feel for what the final weather was at the Cape at launch? Mission Control Yes.
1061,1161,EN-BR,noisy,1.6638125,0,1,0.327722311,0,1,0.331675291,Let me get that for you., Let me get that for you., Let me get that for you.
1062,1162,EN-BR,noisy,7.236625,0.178571429,0.821428571,0.967389107,0.178571429,0.821428571,0.836745977,"The reason why we had that problem on the comm is we just handed over from Texas to MILA, and we're - and you're going through MILA now.", The reason why we had that problem on the com is we just handed over from Texas to Mila and we are and you're going through Mila now.," The reason why we had that problem on the com is we just handed over from Texas to Mila, and we are, and you're going through Mila now."
1063,1163,EN-BR,noisy,1.3039375,0,1,0.24580121,0,1,0.247082949,And it's great., And it's great., And it's great.
1064,1164,EN-BR,noisy,2.9060625,0,1,0.377055168,0,1,0.363167524,So we have a little problem with our Texas site., So we have a little problem with our Texas site., So we have a little problem with our Texas site.
1065,1165,EN-BR,noisy,5.7505,0.2,0.8,0.55816102,0.05,0.95,0.578687191,Mission Control The television coverage had you all the way through staging very well on - and the S-II ignition.," Mission Control, the television coverage had you all the way through staging very well on and the SE ignition.", Mission Control The television coverage had you all the way through staging very well on and the S-II ignition.
1066,1166,EN-BR,noisy,4.6475625,0.058823529,0.941176471,0.512776852,0.058823529,0.941176471,0.532048464,"Then, you went right behind a cloud for a while, but they were tracking you pretty well."," Then you went right behind a cloud for a while, but they were tracking you pretty well."," Then you went right behind a cloud for a while, but they were tracking you pretty well."
1067,1167,EN-BR,noisy,8.8155625,0.085714286,0.914285714,0.846310139,0.057142857,0.942857143,0.842922688,"Mission Control They also - cut in for about a half minute or so and showed a view of the crowd in just the available light from the booster, and it stood out pretty well.", Mission Control they also cut in for about a half minute or so and showed a view of the crowd in just the available light from the booster and it stood out pretty well., Mission Control They also cut in for about a half minute or so and showed a view of the crowd in just the available light from the booster and it stood out pretty well.
1068,1168,EN-BR,noisy,1.5476875,1,0,0.278822899,0,1,0.323442698,"Schmitt Okay, Bob.", Schmidt okay Bob?," Schmitt Okay, Bob."
1069,1169,EN-BR,noisy,3.730375,0,1,0.470837831,0,1,0.469925642,"We're going right over Florida now, looking down at Miami."," We're going right over Florida now, looking down at Miami."," We're going right over Florida now, looking down at Miami."
1070,1170,EN-BR,noisy,4.9378125,0.105263158,0.894736842,0.634994268,0.052631579,0.947368421,0.579761744,"A beautiful view of the Keys all lit up, and I just saw a shooting star right over Miami.", A beautiful view of the keys all lit up and I just saw a shooting star right over Miami.," A beautiful view of the keys all lit up, and I just saw a shooting star right over Miami."
1071,1171,EN-BR,noisy,1.698625,0.333333333,0.666666667,0.245710135,0,1,0.237447977,Mission Control Roger.," Mission Control, Roger.", Mission Control Roger.
1072,1172,EN-BR,noisy,3.1615,0.222222222,0.777777778,0.410225153,0,1,0.41689229,"Schmitt That's a very, very fine view of Miami."," Schmidt, that's a very, very fine view of Miami."," Schmitt That's a very, very fine view of Miami."
1073,1173,EN-BR,noisy,1.2806875,0,1,0.234006882,0,1,0.229483366,Hard to believe., Hard to believe., Hard to believe.
1074,1174,EN-BR,noisy,3.1266875,0.090909091,0.909090909,0.421311855,0.090909091,0.909090909,0.427239895,Mission Control I'll bet they sat there and watched you go.," Mission Control, I'll bet they sat there and watched you go."," Mission Control, I'll bet they sat there and watched you go."
1075,1175,EN-BR,noisy,2.987375,0.2,0.8,0.434950113,0.1,0.9,0.461886644,"Schmitt Looks like we're right over the Bahamas now, Bob."," Schmidt looks like we're right over the Bahamas now, Bob."," Schmitt looks like we're right over the Bahamas now, Bob."
1076,1176,EN-BR,noisy,1.698625,0.333333333,0.666666667,0.215074778,0,1,0.236302376,Mission Control Roger., Mission Control Roger, Mission Control Roger.
1077,1177,EN-BR,noisy,1.2690625,0,1,0.296021223,0,1,0.276329279,I'll buy that., I'll buy that., I'll buy that.
1078,1178,EN-BR,noisy,2.76675,0.285714286,0.714285714,0.444414616,0.285714286,0.714285714,0.505138636,"Schmitt Well, I'm not easily impressed, Bob."," Schmidt, well, I'm not easily impressed, Bob."," Schmitt, well, I'm not easily impressed, Bob."
1079,1179,EN-BR,noisy,2.511375,0.142857143,0.857142857,0.391947269,0,1,0.329431295,But I'm certainly impressed by this one., but I'm certainly impressed by this one., But I'm certainly impressed by this one.
1080,1180,EN-BR,noisy,1.7915,0.333333333,0.666666667,0.210739136,0,1,0.239629745,Mission Control Roger., Mission Control Roger, Mission Control Roger.
1081,1181,EN-BR,noisy,3.2195625,0.1,0.9,0.447807312,0.1,0.9,0.46800375,What's the CMP doing? We haven't heard much from him., What's the Epsy doing? We haven't heard much from him., What's the EPSI doing? We haven't heard much from him.
1082,1182,EN-BR,noisy,4.903,0.421052632,0.578947368,0.552839756,0.210526316,0.789473684,0.557807922,is - is he at the other window? Evans He's crawling around looking for things down in the LEB.," Is this yet the other window? Evans, he's crawling around looking for things down in the lab.", Is is he at the other window? Evans he's crawling around looking for things down in the lab.
1083,1183,EN-BR,noisy,2.0469375,0.75,0.25,0.24657321,0.25,0.75,0.248402596,Mission Control (Laughter) Okay., Mission control after OK., Mission Control After Okay.
1084,1184,EN-BR,noisy,5.2396875,0.166666667,0.833333333,0.610816479,0.111111111,0.888888889,0.612942696,"They won't let you have a window tonight, huh, Ron? Evans No, I'll catch one here pretty quick."," They won't let you have a window tonight, Huron? Evans no, I'll catch one here pretty quick."," They won't let you have a window tonight, Huron! Evans No, I'll catch one here pretty quick."
1085,1185,EN-BR,noisy,3.8465,0.272727273,0.727272727,0.408328056,0,1,0.530045986,"Mission Control Just a reminder, if you haven't already done it.", Mission control just a reminder if you haven't already done it.," Mission Control Just a reminder, if you haven't already done it."
1086,1186,EN-BR,noisy,5.9246875,0.157894737,0.842105263,0.733653069,0.157894737,0.842105263,0.712370872,"There is no need to unstow the TV, because due to this late launch, there's just no site available.", There is no need to un-stow the TV because due to this late launch there's just no site available., There is no need to unstop the TV because due to this late launch there's just no site available.
1087,1187,EN-BR,noisy,1.5709375,1,0,0.292365789,0,1,0.296689034,"Cernan Okay, Bob.", Shenanoke Bob," Cernan Okay, Bob."
